{
  "schema_version": "4.0",
  "software": "spark",
  "version": "3.5.2",
  "hardware": "kunpeng920",
  "os": "oe2403sp4",
  "test_time": "2026-10-22T14:44:32Z",
  "finished_at": "2026-10-22T14:46:04Z",
  "run_status": "completed",
  "display": true,
  "CI_passed": true,
  "PR_merged": false,
  "upstream_supported": true,
  "unsupported_reasons": [],
  "job_url": "https://github.com/FdeCad/boostkit-performance-evaluation/actions/runs/39784091800/job/120191778100",
  "test_cases": [
    {
      "name": "version",
      "description": "bin/spark-submit --version 必须等于请求版本",
      "category": "functional",
      "result": "pass",
      "test_time": "2026-10-22T14:44:32Z"
    },
    {
      "name": "upstream-example",
      "description": "运行官方发行版自带的 SparkPi 示例并断言作业成功输出 Pi 估计值",
      "category": "functional",
      "result": "pass",
      "test_time": "2026-10-22T14:44:32Z"
    },
    {
      "name": "pyspark-smoke",
      "description": "用 pyspark 断言 spark.range(10).count() == 10;Spark<3.5 且容器 Python≥3.13 时跳过(3.3/3.4 的 pyspark 依赖 typing.io,Python 3.13 起移除,上游 v3.5.2 起不再使用),状态记为 skipped 不影响整体通过",
      "category": "functional",
      "result": "pass",
      "test_time": "2026-10-22T14:44:32Z"
    }
  ]
}
