{
  "schema_version": "4.0",
  "software": "scann",
  "version": "1.4.2",
  "hardware": "kunpeng950",
  "os": "oe2403sp4",
  "test_time": "2026-10-23T06:15:36Z",
  "finished_at": "2026-10-23T06:18:06Z",
  "run_status": "completed",
  "display": true,
  "CI_passed": true,
  "PR_merged": false,
  "upstream_supported": true,
  "unsupported_reasons": [],
  "job_url": "https://github.com/nv-action/vllm-benchmarks/actions/runs/39906178119/job/120289671627",
  "test_cases": [
    {
      "name": "version",
      "description": "已安装 scann 版本必须等于请求版本",
      "category": "functional",
      "result": "pass",
      "test_time": "2026-10-23T06:15:36Z"
    },
    {
      "name": "scann-dot-product",
      "description": "dot_product 距离建索引并检索,校验返回形状与邻居合法性",
      "category": "functional",
      "result": "pass",
      "test_time": "2026-10-23T06:15:36Z"
    },
    {
      "name": "scann-squared-l2",
      "description": "squared_l2 距离建索引并检索,校验返回形状一致、邻居合法与距离升序",
      "category": "functional",
      "result": "pass",
      "test_time": "2026-10-23T06:15:36Z"
    }
  ]
}
