{
  "schema_version": "4.0",
  "software": "rocksdb",
  "version": "7.9.2",
  "hardware": "kunpeng920",
  "os": "oe2403sp4",
  "test_time": "2026-10-22T13:36:45Z",
  "finished_at": "2026-10-22T13:38:49Z",
  "run_status": "completed",
  "display": true,
  "CI_passed": true,
  "PR_merged": false,
  "upstream_supported": true,
  "unsupported_reasons": [],
  "job_url": "https://github.com/FdeCad/boostkit-performance-evaluation/actions/runs/39784091800/job/120191779067",
  "test_cases": [
    {
      "name": "version",
      "description": "rocksdb/version.h 中的版本必须等于请求版本",
      "category": "functional",
      "result": "pass",
      "test_time": "2026-10-22T13:36:45Z"
    },
    {
      "name": "upstream-test",
      "description": "运行上游 db_bench 官方工具做写入 + 只读烟测",
      "category": "functional",
      "result": "pass",
      "test_time": "2026-10-22T13:36:45Z"
    },
    {
      "name": "api-smoke",
      "description": "编译并运行最小 C++ 程序验证 Open/Put/Get/reopen",
      "category": "functional",
      "result": "pass",
      "test_time": "2026-10-22T13:36:45Z"
    }
  ]
}
