{
  "schema_version": "4.0",
  "software": "kubernetes",
  "version": "1.37.1",
  "hardware": "kunpeng950",
  "os": "oe2403sp4",
  "test_time": "2026-10-23T09:06:12Z",
  "finished_at": "2026-10-23T09:10:35Z",
  "run_status": "completed",
  "display": true,
  "CI_passed": true,
  "PR_merged": false,
  "upstream_supported": true,
  "unsupported_reasons": [],
  "job_url": "https://github.com/nv-action/vllm-benchmarks/actions/runs/39924948769/job/120347431065",
  "test_cases": [
    {
      "name": "version",
      "description": "kubectl version --client 的客户端版本必须等于请求版本",
      "category": "functional",
      "result": "pass",
      "test_time": "2026-10-23T09:06:12Z"
    },
    {
      "name": "upstream-test",
      "description": "用 kubectl create deployment --dry-run=client 离线渲染 Deployment 并校验字段",
      "category": "functional",
      "result": "pass",
      "test_time": "2026-10-23T09:06:12Z"
    },
    {
      "name": "kubectl-smoke",
      "description": "kubectl create 离线渲染 ConfigMap 与 Job 的 YAML 并校验类型和名称",
      "category": "functional",
      "result": "pass",
      "test_time": "2026-10-23T09:06:12Z"
    }
  ]
}
