{
  "schema_version": "4.0",
  "software": "faiss",
  "version": "1.15.1",
  "hardware": "kunpeng950",
  "os": "oe2403sp4",
  "test_time": "2026-10-23T05:33:03Z",
  "finished_at": "2026-10-23T05:35:25Z",
  "run_status": "completed",
  "display": true,
  "CI_passed": true,
  "PR_merged": false,
  "upstream_supported": true,
  "unsupported_reasons": [],
  "job_url": "https://github.com/nv-action/vllm-benchmarks/actions/runs/39906178119/job/120289646040",
  "test_cases": [
    {
      "name": "version",
      "description": "已安装 faiss 版本必须等于请求版本",
      "category": "functional",
      "result": "pass",
      "test_time": "2026-10-23T05:33:03Z"
    },
    {
      "name": "index-flat-l2",
      "description": "构建 IndexFlatL2,add 向量,search 返回最近邻并校验与暴力计算一致",
      "category": "functional",
      "result": "pass",
      "test_time": "2026-10-23T05:33:03Z"
    },
    {
      "name": "index-ivf-pq",
      "description": "训练 IndexIVFPQ 量化索引,add 向量并检索,校验训练/入库状态与邻居合法性",
      "category": "functional",
      "result": "pass",
      "test_time": "2026-10-23T05:33:03Z"
    }
  ]
}
