{
  "schema_version": "4.0",
  "software": "flink",
  "version": "2.3.0",
  "hardware": "kunpeng920",
  "os": "oe2403sp4",
  "test_time": "2026-10-22T13:18:55Z",
  "finished_at": "2026-10-22T13:20:54Z",
  "run_status": "completed",
  "display": true,
  "CI_passed": true,
  "PR_merged": false,
  "upstream_supported": true,
  "unsupported_reasons": [],
  "job_url": "https://github.com/FdeCad/boostkit-performance-evaluation/actions/runs/39784091800/job/120191776608",
  "test_cases": [
    {
      "name": "version",
      "description": "bin/flink --version 必须等于请求版本",
      "category": "functional",
      "result": "pass",
      "test_time": "2026-10-22T13:18:55Z"
    },
    {
      "name": "upstream-example",
      "description": "运行官方发行版自带的 WordCount 示例并断言作业成功结束",
      "category": "functional",
      "result": "pass",
      "test_time": "2026-10-22T13:18:55Z"
    },
    {
      "name": "cluster-smoke",
      "description": "启动本地 standalone mini-cluster(JobManager+TaskManager)并校验 TaskManager 已注册",
      "category": "functional",
      "result": "pass",
      "test_time": "2026-10-22T13:18:55Z"
    }
  ]
}
