{
  "schema_version": "4.0",
  "software": "snappy",
  "version": "1.1.7",
  "hardware": "kunpeng950",
  "os": "oe2403sp4",
  "test_time": "2026-10-23T08:20:34Z",
  "finished_at": "2026-10-23T08:21:41Z",
  "run_status": "completed",
  "display": true,
  "CI_passed": true,
  "PR_merged": false,
  "upstream_supported": true,
  "unsupported_reasons": [],
  "job_url": "https://github.com/FdeCad/boostkit-performance-evaluation/actions/runs/39923102905/job/120315645731",
  "test_cases": [
    {
      "name": "source-integrity",
      "description": "固定 tag 的源码归档 SHA-256 必须匹配 source-lock.json 基线",
      "category": "functional",
      "result": "pass",
      "test_time": "2026-10-23T08:20:34Z"
    },
    {
      "name": "version",
      "description": "被测 SnappyConfigVersion.cmake 报告的版本必须等于请求版本,且带版本号的库文件存在",
      "category": "functional",
      "result": "pass",
      "test_time": "2026-10-23T08:20:34Z"
    },
    {
      "name": "roundtrip",
      "description": "链接被测 libsnappy 的 C++ 程序做 Compress/Uncompress 回环校验",
      "category": "functional",
      "result": "pass",
      "test_time": "2026-10-23T08:20:34Z"
    }
  ]
}
