{
  "schema_version": "4.0",
  "software": "envoy",
  "version": "1.40.0",
  "hardware": "kunpeng950",
  "os": "oe2403sp4",
  "test_time": "2026-10-26T06:57:56Z",
  "finished_at": "2026-10-26T07:00:46Z",
  "run_status": "completed",
  "display": true,
  "CI_passed": true,
  "PR_merged": false,
  "upstream_supported": true,
  "unsupported_reasons": [],
  "job_url": "https://github.com/nv-action/vllm-benchmarks/actions/runs/40282808541/job/121439881353",
  "test_cases": [
    {
      "name": "version",
      "description": "envoy --version 的版本号必须等于请求版本",
      "category": "functional",
      "result": "pass",
      "test_time": "2026-10-26T06:57:56Z"
    },
    {
      "name": "upstream-test",
      "description": "用 envoy --mode validate 校验一份最小静态配置",
      "category": "functional",
      "result": "pass",
      "test_time": "2026-10-26T06:57:56Z"
    },
    {
      "name": "proxy-smoke",
      "description": "启动 envoy 实例,探活 admin /ready 与 listener 直答 200 ok",
      "category": "functional",
      "result": "pass",
      "test_time": "2026-10-26T06:57:56Z"
    }
  ]
}
