{
  "schema_version": "4.0",
  "software": "cloudwego",
  "version": "0.16.4",
  "hardware": "kunpeng950",
  "os": "oe2403sp4",
  "test_time": "2026-10-23T10:02:05Z",
  "finished_at": "2026-10-23T10:30:49Z",
  "run_status": "completed",
  "display": true,
  "CI_passed": true,
  "PR_merged": false,
  "upstream_supported": true,
  "unsupported_reasons": [],
  "job_url": "https://github.com/nv-action/vllm-benchmarks/actions/runs/39936019631/job/120356077024",
  "test_cases": [
    {
      "name": "source-integrity",
      "description": "四个固定 tag 的源码归档 SHA-256 必须匹配仓库内基线",
      "category": "functional",
      "result": "pass",
      "test_time": "2026-10-23T10:02:05Z"
    },
    {
      "name": "version",
      "description": "检查实际 Kitex、hz、volo CLI 版本及 Eino 源码标记",
      "category": "functional",
      "result": "pass",
      "test_time": "2026-10-23T10:02:05Z"
    },
    {
      "name": "upstream-test",
      "description": "实际运行 Kitex client 和 Hertz pkg 的上游测试，禁用测试缓存",
      "category": "functional",
      "result": "pass",
      "test_time": "2026-10-23T10:02:05Z"
    },
    {
      "name": "smoke",
      "description": "Hertz 最小 HTTP 服务回环，校验状态码及 JSON 响应",
      "category": "functional",
      "result": "pass",
      "test_time": "2026-10-23T10:02:05Z"
    },
    {
      "name": "codegen",
      "description": "使用实际 Kitex、hz、volo 工具处理本地 Thrift IDL 并检查生成文件",
      "category": "functional",
      "result": "pass",
      "test_time": "2026-10-23T10:02:05Z"
    },
    {
      "name": "generated-build",
      "description": "Kitex、hz 生成代码执行 go build，Volo 生成项目执行 cargo build --locked",
      "category": "functional",
      "result": "pass",
      "test_time": "2026-10-23T10:02:05Z"
    },
    {
      "name": "kitex-rpc",
      "description": "使用生成的服务代码启动 Kitex TCP 服务并校验三种请求的精确响应",
      "category": "functional",
      "result": "pass",
      "test_time": "2026-10-23T10:02:05Z"
    },
    {
      "name": "eino-test",
      "description": "运行 Eino schema 和 prompt 的离线单元测试",
      "category": "functional",
      "result": "pass",
      "test_time": "2026-10-23T10:02:05Z"
    }
  ]
}
