{
  "schema_version": "4.0",
  "software": "gcc",
  "version": "16.2.0",
  "hardware": "kunpeng950",
  "os": "oe2403sp4",
  "test_time": "2026-10-23T08:31:50Z",
  "finished_at": "2026-10-23T09:05:58Z",
  "run_status": "completed",
  "display": true,
  "CI_passed": true,
  "PR_merged": false,
  "upstream_supported": true,
  "unsupported_reasons": [],
  "job_url": "https://github.com/nv-action/vllm-benchmarks/actions/runs/39924948769/job/120347441812",
  "test_cases": [
    {
      "name": "version",
      "description": "获取到的 gcc 版本必须等于请求版本(层1/2/2b/3 任一来源均须匹配)",
      "category": "functional",
      "result": "pass",
      "test_time": "2026-10-23T08:31:50Z"
    },
    {
      "name": "upstream-test",
      "description": "编译并运行一个 C 程序(gcc 功能验证)",
      "category": "functional",
      "result": "pass",
      "test_time": "2026-10-23T08:31:50Z"
    },
    {
      "name": "smoke",
      "description": "编译并运行一个 C++ 程序(g++ 功能验证)",
      "category": "functional",
      "result": "pass",
      "test_time": "2026-10-23T08:31:50Z"
    }
  ]
}
