{
  "schema_version": "4.0",
  "software": "python",
  "version": "3.15.0",
  "hardware": "kunpeng950",
  "os": "oe2403sp4",
  "test_time": "2026-10-23T07:14:03Z",
  "finished_at": "2026-10-23T07:20:17Z",
  "run_status": "completed",
  "display": true,
  "CI_passed": true,
  "PR_merged": false,
  "upstream_supported": true,
  "unsupported_reasons": [],
  "job_url": "https://github.com/nv-action/vllm-benchmarks/actions/runs/39916091683/job/120295288679",
  "test_cases": [
    {
      "name": "version",
      "description": "获取到的 CPython 解释器版本必须等于请求版本(层1/2/3/4 任一来源均须匹配)",
      "category": "functional",
      "result": "pass",
      "test_time": "2026-10-23T07:14:03Z"
    },
    {
      "name": "upstream-test",
      "description": "运行 CPython 官方回归测试子集(test_math / test_json)",
      "category": "functional",
      "result": "pass",
      "test_time": "2026-10-23T07:14:03Z"
    },
    {
      "name": "smoke",
      "description": "compileall 临时目录 + 运行内建模块断言",
      "category": "functional",
      "result": "pass",
      "test_time": "2026-10-23T07:14:03Z"
    }
  ]
}
