{
  "schema_version": "4.0",
  "software": "x265",
  "version": "4.2",
  "hardware": "kunpeng950",
  "os": "ub2604",
  "test_time": "2026-10-23T08:15:34Z",
  "finished_at": "2026-10-23T08:18:15Z",
  "run_status": "completed",
  "display": true,
  "CI_passed": true,
  "PR_merged": false,
  "upstream_supported": true,
  "unsupported_reasons": [],
  "job_url": "https://github.com/FdeCad/boostkit-performance-evaluation/actions/runs/39922024879/job/120317546386",
  "test_cases": [
    {
      "name": "version",
      "description": "x265 --version 的版本号必须等于请求版本",
      "category": "functional",
      "result": "pass",
      "test_time": "2026-10-23T08:15:34Z"
    },
    {
      "name": "quality-metrics",
      "description": "编码 3 帧，校验 PSNR 为有限正数、SSIM 为 [0,1] 内有限数",
      "category": "functional",
      "result": "pass",
      "test_time": "2026-10-23T08:15:34Z"
    },
    {
      "name": "encode-smoke",
      "description": "生成裸 YUV 并用 x265 CLI 编码成码流,校验码流含 NAL 起始码",
      "category": "functional",
      "result": "pass",
      "test_time": "2026-10-23T08:15:34Z"
    },
    {
      "name": "decoder-dependencies",
      "description": "按需安装 FFmpeg，ffmpeg 和 ffprobe 必须可用，安装失败不跳过",
      "category": "functional",
      "result": "pass",
      "test_time": "2026-10-23T08:15:34Z"
    },
    {
      "name": "decode-check",
      "description": "完整解码无错误，HEVC 64x64，3 帧，I420 输出 18432 字节",
      "category": "functional",
      "result": "pass",
      "test_time": "2026-10-23T08:15:34Z"
    }
  ]
}
