{
  "schema_version": "4.0",
  "software": "x264",
  "version": "0480cb05",
  "hardware": "kunpeng920",
  "os": "oe2403sp4",
  "test_time": "2026-10-23T01:02:27Z",
  "finished_at": "2026-10-23T01:05:02Z",
  "run_status": "completed",
  "display": true,
  "CI_passed": true,
  "PR_merged": false,
  "upstream_supported": true,
  "unsupported_reasons": [],
  "job_url": "https://github.com/FdeCad/boostkit-performance-evaluation/actions/runs/39784091800/job/120191780247",
  "test_cases": [
    {
      "name": "version",
      "description": "校验固定源码归档及对应 CLI 版本，分别记录提交号和实际版本",
      "category": "functional",
      "result": "pass",
      "test_time": "2026-10-23T01:02:27Z"
    },
    {
      "name": "upstream-checkasm",
      "description": "运行上游 checkasm 汇编一致性测试",
      "category": "functional",
      "result": "pass",
      "test_time": "2026-10-23T01:02:27Z"
    },
    {
      "name": "encode-smoke",
      "description": "生成裸 YUV 并用 x264 CLI 编码成码流,校验码流含 NAL 起始码",
      "category": "functional",
      "result": "pass",
      "test_time": "2026-10-23T01:02:27Z"
    },
    {
      "name": "decoder-dependencies",
      "description": "按需安装 FFmpeg，依赖不可用则失败",
      "category": "functional",
      "result": "pass",
      "test_time": "2026-10-23T01:02:27Z"
    },
    {
      "name": "decode-check",
      "description": "H.264 64x64，完整解码 3 帧，I420 输出 18432 字节",
      "category": "functional",
      "result": "pass",
      "test_time": "2026-10-23T01:02:27Z"
    }
  ]
}
