{
  "schema_version": "4.0",
  "software": "openjdk",
  "version": "28_19",
  "hardware": "kunpeng920",
  "os": "ub2604",
  "test_time": "2026-10-22T16:01:01Z",
  "finished_at": "2026-10-22T16:02:12Z",
  "run_status": "completed",
  "display": true,
  "CI_passed": true,
  "PR_merged": false,
  "upstream_supported": true,
  "unsupported_reasons": [],
  "job_url": "https://github.com/FdeCad/boostkit-performance-evaluation/actions/runs/39784091800/job/120191782279",
  "test_cases": [
    {
      "name": "version",
      "description": "java -version 的 feature 号必须等于请求版本的 feature 号",
      "category": "functional",
      "result": "pass",
      "test_time": "2026-10-22T16:01:01Z"
    },
    {
      "name": "upstream-test",
      "description": "javac 编译并 java 运行一个 Hello 程序",
      "category": "functional",
      "result": "pass",
      "test_time": "2026-10-22T16:01:01Z"
    },
    {
      "name": "smoke",
      "description": "java 运行一个使用 java.util.stream 的程序",
      "category": "functional",
      "result": "pass",
      "test_time": "2026-10-22T16:01:01Z"
    }
  ]
}
