{
  "schema_version": "4.0",
  "software": "brpc",
  "version": "1.18.0",
  "hardware": "kunpeng920",
  "os": "ub2604",
  "test_time": "2026-10-22T14:40:08Z",
  "finished_at": "2026-10-22T14:44:29Z",
  "run_status": "completed",
  "display": true,
  "CI_passed": true,
  "PR_merged": false,
  "upstream_supported": true,
  "unsupported_reasons": [],
  "job_url": "https://github.com/FdeCad/boostkit-performance-evaluation/actions/runs/39784091800/job/120191781195",
  "test_cases": [
    {
      "name": "version",
      "description": "源码 RELEASE_VERSION/镜像内版本必须等于请求版本",
      "category": "functional",
      "result": "pass",
      "test_time": "2026-10-22T14:40:08Z"
    },
    {
      "name": "upstream-test",
      "description": "编译并运行上游 example/echo_c++ 的 server/client 完成一次 RPC 回环",
      "category": "functional",
      "result": "pass",
      "test_time": "2026-10-22T14:40:08Z"
    },
    {
      "name": "cpp-smoke",
      "description": "编译链接 libbrpc 的最小程序,验证头文件与静态库可用",
      "category": "functional",
      "result": "pass",
      "test_time": "2026-10-22T14:40:08Z"
    }
  ]
}
