{
  "schema_version": "4.0",
  "software": "envoy",
  "version": "1.37.1",
  "hardware": "kunpeng920",
  "os": "ub2604",
  "test_time": "2026-10-21T15:07:39Z",
  "finished_at": "2026-10-21T15:08:28Z",
  "run_status": "completed",
  "display": false,
  "CI_passed": false,
  "PR_merged": false,
  "upstream_supported": true,
  "unsupported_reasons": [],
  "job_url": "https://github.com/FdeCad/boostkit-performance-evaluation/actions/runs/39622847513/job/119300574024",
  "test_cases": []
}
