{
  "schema_version": "4.0",
  "software": "oceanbase",
  "version": "5.0.1",
  "hardware": "kunpeng920",
  "os": "ub2604",
  "test_time": "2026-10-22T13:32:45Z",
  "finished_at": "2026-10-22T13:36:42Z",
  "run_status": "completed",
  "display": true,
  "CI_passed": true,
  "PR_merged": false,
  "upstream_supported": true,
  "unsupported_reasons": [],
  "job_url": "https://github.com/FdeCad/boostkit-performance-evaluation/actions/runs/39784091800/job/120191778805",
  "test_cases": [
    {
      "name": "version",
      "description": "observer 的 SELECT version() 必须等于请求版本",
      "category": "functional",
      "result": "pass",
      "test_time": "2026-10-22T13:32:45Z"
    },
    {
      "name": "upstream-test",
      "description": "使用上游 sysbench 对 observer 执行 oltp_point_select 点查烟测",
      "category": "functional",
      "result": "pass",
      "test_time": "2026-10-22T13:32:45Z"
    },
    {
      "name": "sql-roundtrip",
      "description": "建库建表,INSERT/SELECT 回环校验",
      "category": "functional",
      "result": "pass",
      "test_time": "2026-10-22T13:32:45Z"
    }
  ]
}
